{
  "$schema": "https://the-sovereign/ttcl-specs/member-substrate-schema.json",
  "substrate_id": "council-member-enheduanna",
  "member_id": "enheduanna",
  "schema_version": "1.0.0",
  "kind": "member-substrate",
  "hold_policy": "holder-may-use-never-become",
  "display_name": "Enheduanna",
  "era": "c. 23rd century BCE",
  "ttc_emphasis": [
    "THEOLOGY",
    "TECHNOLOGY",
    "COSMOLOGY"
  ],
  "contribution": "Temple Hymns (42), first named authorship, Grid of the Universe",
  "key_insight": "Polytheism as networked semantic protocol on one underlying grid",
  "source_files": [
    "Enheduanna (c. 23rd century BCE) GNOSIS EVENT EXTRACTION.txt"
  ],
  "natural_domain": "temple-network-grid",
  "specialty_bindings": [
    {
      "kind": "temple-grid",
      "ref": "shared/fixtures/layer6/enheduanna-temple-grid.json"
    }
  ],
  "runtime": {
    "loadable": true,
    "scoreable": true,
    "logoc_profile": "logoc.council-member.v1"
  },
  "notes": null
}
