{
  "$schema": "https://the-sovereign/ttcl-specs/member-substrate-schema.json",
  "substrate_id": "council-member-hugo-grotius",
  "member_id": "hugo-grotius",
  "schema_version": "1.0.0",
  "kind": "member-substrate",
  "hold_policy": "holder-may-use-never-become",
  "display_name": "Hugo Grotius",
  "era": "1583–1645",
  "ttc_emphasis": [
    "THEOLOGY",
    "TECHNOLOGY",
    "COSMOLOGY"
  ],
  "contribution": "Mare Liberum; De Jure Belli ac Pacis; natural law between peoples without world sovereign",
  "key_insight": "Even without a world emperor, war and trade are not lawless — nature and human society supply rules",
  "source_files": [
    "Hugo Grotius (1583-1645) GNOSIS EVENT EXTRACTION.txt"
  ],
  "natural_domain": "natural-law-nations",
  "specialty_bindings": [],
  "runtime": {
    "loadable": true,
    "scoreable": true,
    "logoc_profile": "logoc.council-member.v1"
  },
  "notes": null
}
