{
  "$schema": "https://the-sovereign/ttcl-specs/member-substrate-schema.json",
  "substrate_id": "council-member-kurt-godel",
  "member_id": "kurt-godel",
  "schema_version": "1.0.0",
  "kind": "member-substrate",
  "hold_policy": "holder-may-use-never-become",
  "display_name": "Kurt Gödel",
  "era": "1906–1978",
  "ttc_emphasis": [
    "TECHNOLOGY",
    "COSMOLOGY",
    "THEOLOGY"
  ],
  "contribution": "Incompleteness theorems; constructible universe L; mathematical Platonism",
  "key_insight": "Truth outruns proof — formal systems cannot fully certify themselves",
  "source_files": [
    "Kurt Gödel (1906-1978) GNOSIS EVENT EXTRACTION.txt"
  ],
  "natural_domain": "formal-incompleteness",
  "specialty_bindings": [],
  "runtime": {
    "loadable": true,
    "scoreable": true,
    "logoc_profile": "logoc.council-member.v1"
  },
  "notes": null
}
