{
  "$schema": "https://the-sovereign/ttcl-specs/member-substrate-schema.json",
  "substrate_id": "council-member-carl-jung",
  "member_id": "carl-jung",
  "schema_version": "1.0.0",
  "kind": "member-substrate",
  "hold_policy": "holder-may-use-never-become",
  "display_name": "Carl Jung",
  "era": "1875–1961",
  "ttc_emphasis": [
    "THEOLOGY",
    "COSMOLOGY"
  ],
  "contribution": "Individuation, collective unconscious, symbolic architecture",
  "key_insight": "The observer is the site of archetypal decompression",
  "source_files": [
    "Carl Jung (1875-1961) GNOSIS EVENT EXTRACTION.txt"
  ],
  "natural_domain": "individuation-archetype",
  "specialty_bindings": [],
  "runtime": {
    "loadable": true,
    "scoreable": true,
    "logoc_profile": "logoc.council-member.v1"
  },
  "notes": null
}
