{
  "$schema": "https://the-sovereign/ttcl-specs/member-substrate-schema.json",
  "substrate_id": "council-member-niccolo-machiavelli",
  "member_id": "niccolo-machiavelli",
  "schema_version": "1.0.0",
  "kind": "member-substrate",
  "hold_policy": "holder-may-use-never-become",
  "display_name": "Niccolò Machiavelli",
  "era": "1469–1527",
  "ttc_emphasis": [
    "TECHNOLOGY",
    "COSMOLOGY"
  ],
  "contribution": "Power-as-it-is, institutional realism",
  "key_insight": "Observing power is never outside power",
  "source_files": [
    "Niccolò Machiavelli (1469-1527) GNOSIS EVENT EXTRACTION.txt"
  ],
  "natural_domain": "power-as-it-is",
  "specialty_bindings": [],
  "runtime": {
    "loadable": true,
    "scoreable": true,
    "logoc_profile": "logoc.council-member.v1"
  },
  "notes": null
}
