{
  "$schema": "https://the-sovereign/ttcl-specs/member-substrate-schema.json",
  "substrate_id": "council-member-ramon-llull",
  "member_id": "ramon-llull",
  "schema_version": "1.0.0",
  "kind": "member-substrate",
  "hold_policy": "holder-may-use-never-become",
  "display_name": "Ramon Llull",
  "era": "1232–1315",
  "ttc_emphasis": [
    "TECHNOLOGY",
    "THEOLOGY",
    "COSMOLOGY"
  ],
  "contribution": "Operative wheels, combinatorial logic, Ars Magna",
  "key_insight": "Constraint generates possibility, not limits it",
  "source_files": [
    "Ramon Llull (1232-1315) GNOSIS EVENT EXTRACTION.txt"
  ],
  "natural_domain": "combinatorial-wheels",
  "specialty_bindings": [
    {
      "kind": "wheel-registry",
      "ref": "shared/fixtures/layer6/wheel-registry.json"
    }
  ],
  "runtime": {
    "loadable": true,
    "scoreable": true,
    "logoc_profile": "logoc.council-member.v1"
  },
  "notes": null
}
