{
  "$schema": "https://the-sovereign/ttcl-specs/member-substrate-schema.json",
  "substrate_id": "council-member-hippocrates",
  "member_id": "hippocrates",
  "schema_version": "1.0.0",
  "kind": "member-substrate",
  "hold_policy": "holder-may-use-never-become",
  "display_name": "Hippocrates",
  "era": "c. 460–c. 370 BCE",
  "ttc_emphasis": [
    "THEOLOGY",
    "TECHNOLOGY",
    "COSMOLOGY"
  ],
  "contribution": "Hippocratic Corpus tradition; prognosis; natural causes of disease; medical ethics lineage",
  "key_insight": "Disease has natural causes — the physician reads the body and the environment, not only the gods",
  "source_files": [
    "Hippocrates (c. 460-c. 370 BCE) GNOSIS EVENT EXTRACTION.txt"
  ],
  "natural_domain": "natural-medicine",
  "specialty_bindings": [],
  "runtime": {
    "loadable": true,
    "scoreable": true,
    "logoc_profile": "logoc.council-member.v1"
  },
  "notes": null
}
